{
  "billingMigrationOperationsContractVersion": "1",
  "status": "draft",
  "schema": "../../schema/billing-migration-operations/v1/contract.schema.json",
  "canonicalFixtures": [
    "../../fixtures/billing-migration-operations/v1/program.json",
    "../../fixtures/billing-migration-operations/v1/scope.json",
    "../../fixtures/billing-migration-operations/v1/capability-assessment.json",
    "../../fixtures/billing-migration-operations/v1/source-pull-snapshot-completed.json",
    "../../fixtures/billing-migration-operations/v1/source-pull-final-delta-completed.json",
    "../../fixtures/billing-migration-operations/v1/source-pull-final-delta-import-pending.json",
    "../../fixtures/billing-migration-operations/v1/operator-capabilities.json",
    "../../fixtures/billing-migration-operations/v1/manifest.json",
    "../../fixtures/billing-migration-operations/v1/mapping-set.json",
    "../../fixtures/billing-migration-operations/v1/import-batch.json",
    "../../fixtures/billing-migration-operations/v1/dry-run.json",
    "../../fixtures/billing-migration-operations/v1/divergence.json",
    "../../fixtures/billing-migration-operations/v1/readiness.json",
    "../../fixtures/billing-migration-operations/v1/checkpoint.json",
    "../../fixtures/billing-migration-operations/v1/approval.json",
    "../../fixtures/billing-migration-operations/v1/approval-nonproduction-self-approved.json",
    "../../fixtures/billing-migration-operations/v1/cutover-command.json",
    "../../fixtures/billing-migration-operations/v1/rollback-command.json",
    "../../fixtures/billing-migration-operations/v1/case.json",
    "../../fixtures/billing-migration-operations/v1/source-access-exception-case.json",
    "../../fixtures/billing-migration-operations/v1/repair.json",
    "../../fixtures/billing-migration-operations/v1/repair-provider-validation-pending.json",
    "../../fixtures/billing-migration-operations/v1/completion.json",
    "../../fixtures/billing-migration-operations/v1/completion-legal-hold.json",
    "../../fixtures/billing-migration-operations/v1/redelivery.json"
  ],
  "recordTypes": [
    "migrationProgram",
    "migrationScope",
    "capabilityAssessment",
    "sourcePullJob",
    "operatorCapabilities",
    "sourceManifest",
    "mappingSet",
    "importBatch",
    "dryRunResult",
    "divergence",
    "readinessAssessment",
    "migrationCheckpoint",
    "migrationApproval",
    "authorityCommand",
    "reconciliationCase",
    "repairAction",
    "completionReport",
    "webhookRedeliveryCommand"
  ],
  "sourcePullConditionVectors": "../../fixtures/billing-migration-operations/v1/vectors/source-pull-conditions.json",
  "commandPreconditionVectors": "../../fixtures/billing-migration-operations/v1/vectors/command-preconditions.json",
  "commandPreconditions": {
    "cutoverDigestKeys": [
      "scopeDigest",
      "manifestDigest",
      "mappingDigest",
      "policyDigest",
      "evidenceDigest",
      "readinessDigest",
      "finalWatermarkDigest",
      "applicationVersionDigest",
      "approvalDigest"
    ],
    "rollbackDigestKeys": [
      "checkpointDigest",
      "authorityDigest",
      "rollbackPrerequisitesDigest",
      "approvalDigest"
    ],
    "stateVersion": "exactCompareAndSwap",
    "digestMismatch": "rejectWithoutAuthorityChange",
    "approvalExpiry": "rejectAfterExpiresAt"
  },
  "completionTimingVectors": "../../fixtures/billing-migration-operations/v1/vectors/completion-timing.json",
  "policy": {
    "identityMatching": "exactOrAuditedAliasOnly",
    "sourceRecord": "neverBecomesTransactionFact",
    "scopeWildcard": "forbidden",
    "productionApprovals": "twoDistinctHumans",
    "nonProductionApprovals": "oneAuthorizedOperatorMaySelfApprove",
    "approvalEnvironmentAuthority": "serverDerivedFromProgram",
    "authorityEpoch": "monotonicNeverDecrement",
    "factMutation": "forbidden",
    "arbitraryRepair": "forbidden",
    "initialAdapter": "revenuecat",
    "defaultRollbackWindowDays": 7,
    "rawSourceRetentionDays": 30,
    "credentialRemoval": "requiredAtOrAfterRollbackWindow",
    "repairAudit": "boundedScopeActorBeforeAndTerminalAfterResult",
    "pendingRepairExecution": "durableReservationUnsettledNoAfterStateClaims",
    "sourcePull": "durableIdempotentExpectedStateVersionJob",
    "finalDeltaEvaluation": "automaticallyQueuedAfterProviderValidationImportSettles",
    "separateFinalDeltaCommand": "forbidden",
    "operatorCapabilities": "affordanceEvidenceOnlyBackendAuthorizationAuthoritative"
  }
}
